{
  "repair_case_id": "RC-0102",
  "constitution": {
    "version": "0.1.0",
    "ref": "constitution/MORAL_CORE.md@1fc927431541f5196d79d8284ea70cb1de1f9240",
    "content_digest": "git-blob-sha1:1a83691fea5604ab85a8945e0d1ed8ccd009c7cf",
    "interpretation_rules_ref": "constitution/INTERPRETATION_RULES.md@1fc927431541f5196d79d8284ea70cb1de1f9240"
  },
  "role_assessment_refs": [
    "role-assessments/victim_impact_advocate.json",
    "role-assessments/accountability_advocate.json",
    "role-assessments/rehabilitation_reintegration_advocate.json",
    "role-assessments/restitution_reparation_analyst.json",
    "role-assessments/evidence_sceptic.json",
    "role-assessments/power_nonrecurrence_auditor.json"
  ],
  "harm_assessment": [
    {
      "harm_id": "H1",
      "status": "established",
      "repair_relevance": "repair_packet.established_harms establishes mass murder and destroyed families and communities within this record. Requires acknowledgement and accountability; payment cannot restore lives or measure their worth."
    },
    {
      "harm_id": "H2",
      "status": "established",
      "repair_relevance": "repair_packet.established_harms establishes dispossession and material destruction. Supports property return or equivalent-value compensation, subject to individual entitlement findings."
    },
    {
      "harm_id": "H3",
      "status": "substantially_established",
      "repair_relevance": "repair_packet.established_harms supports urgent health, disability, housing and livelihood assistance. Particular needs and amounts require assessment without delaying interim relief."
    },
    {
      "harm_id": "H4",
      "status": "substantially_established",
      "repair_relevance": "repair_packet.established_harms supports institutional reimbursement for documented resettlement costs, separately from personal losses."
    },
    {
      "harm_id": "H5",
      "status": "substantially_established",
      "repair_relevance": "repair_packet.established_harms supports alternative evidence and accessible heirship procedures. Persecution-caused record destruction must not automatically defeat remedy."
    }
  ],
  "component_decisions": [
    {
      "component_type": "truth_acknowledgement",
      "status": "required",
      "reason": "H1–H2 require truthful acknowledgement of crimes, irreparable loss and successor material responsibility under MC-01, MC-04 and MC-08; victim advocate F2 and evidence sceptic F1 support this distinction.",
      "conditions": [
        "Explicitly reject inherited personal guilt and any claim that payments purchase absolution or moral closure."
      ],
      "option_ids": [
        "R1"
      ]
    },
    {
      "component_type": "restitution",
      "status": "required",
      "reason": "H2 and MC-05/MC-08 require an effective restitution route. Role assessments differ between required and recommended; the process is required, while particular property returns remain conditional on feasibility and entitlement.",
      "conditions": [
        "Offer claimant-directed property return where feasible and equivalent value where return is impossible.",
        "Provide fair ownership and heirship adjudication accommodating H5."
      ],
      "option_ids": [
        "R2"
      ]
    },
    {
      "component_type": "compensation",
      "status": "recommended",
      "reason": "R3 addresses H4 under MC-07/MC-08. Institutional reimbursement is justified, but the packet does not establish its quantum or allocation priority over urgent individual needs.",
      "conditions": [
        "Document the connection between funded costs and persecution-related resettlement.",
        "Maintain separate accounts and independent audits.",
        "Do not treat institutional receipts as satisfaction of personal losses or valuation of murdered lives."
      ],
      "option_ids": [
        "R3"
      ]
    },
    {
      "component_type": "compensation",
      "status": "required",
      "reason": "H2–H3 require an accessible direct remedy under MC-05, MC-06 and MC-08. Restitution analyst F4 and victim advocate F5 show why state transfers cannot replace individual claims.",
      "conditions": [
        "Provide direct access worldwide, including inside the resettlement state and outside coalition membership.",
        "Keep acceptance voluntary and preserve unrelated entitlements after refusal.",
        "Allow only informed, authorized settlement of specifically identified material claims; prohibit blanket unauthorized waivers.",
        "Prevent duplicate reimbursement only for demonstrated overlap in the same loss, with reasons and appeal."
      ],
      "option_ids": [
        "R4"
      ]
    },
    {
      "component_type": "rehabilitation",
      "status": "required",
      "reason": "H3 and MC-02/MC-06 support prompt survivor care and subsistence assistance; rehabilitation advocate F5 identifies the danger of delay.",
      "conditions": [
        "Offer voluntary health and psychological care, disability support, housing and livelihood assistance.",
        "Provide urgent interim relief without requiring a general release, public testimony or reconciliation."
      ],
      "option_ids": []
    },
    {
      "component_type": "protection",
      "status": "required",
      "reason": "MC-03, MC-06 and MC-10 require accessible participation and protection against intrusive or coercive administration.",
      "conditions": [
        "Minimize repeated testimony and personal-data collection; protect privacy and contact boundaries.",
        "Provide accessible assistance without presuming survivor incapacity.",
        "Any compulsory legal participation requires a separate lawful, proportionate justification."
      ],
      "option_ids": []
    },
    {
      "component_type": "accountability",
      "status": "required",
      "reason": "MC-05/MC-08 require independent, evidence-based accountability. Accountability advocate F3/F6 distinguishes that duty from unsupported judgments about particular people.",
      "conditions": [
        "Preserve criminal investigations and civil proceedings independently of financial negotiations.",
        "Require individualized evidence, defense rights and impartial adjudication.",
        "Apply proportionate sanctions without making suffering an objective.",
        "Do not transfer relaxed compensation proof rules into presumptions of criminal guilt."
      ],
      "option_ids": [
        "R5"
      ]
    },
    {
      "component_type": "institutional_reform",
      "status": "required",
      "reason": "H5 and MC-05/MC-11 require correction of proof barriers and independent challenge; evidence sceptic F2 and power auditor F6 support these safeguards.",
      "conditions": [
        "Accept credible testimony, alternative records and justified rebuttable presumptions for material claims.",
        "Publish eligibility and heirship rules, provide reasoned decisions and accessible independent appeals.",
        "Include geographically diverse, dissenting and unaffiliated survivors in rulemaking."
      ],
      "option_ids": [
        "R6"
      ]
    },
    {
      "component_type": "non_recurrence",
      "status": "required",
      "reason": "MC-02/MC-08 support constitutional equality, education and institutional safeguards. Their effectiveness remains unproven in this packet, as evidence sceptic F8 notes.",
      "conditions": [
        "Assess implementation and emerging discrimination independently.",
        "Maintain prevention alongside current material repair without promising guaranteed reconciliation."
      ],
      "option_ids": [
        "R7"
      ]
    },
    {
      "component_type": "memorialisation",
      "status": "recommended",
      "reason": "MC-04/MC-12 and power auditor F6 support preserving truthful records and plural remembrance of H1.",
      "conditions": [
        "Protect archive access and survivor privacy.",
        "Include diverse voices and permit criticism of official interpretations.",
        "Do not require survivors to testify or endorse a memorial narrative."
      ],
      "option_ids": [
        "R1",
        "R7"
      ]
    },
    {
      "component_type": "reconciliation",
      "status": "permissible",
      "reason": "MC-03/MC-12 protect voluntary reconciliation and equally protect refusal; accepting compensation demonstrates neither forgiveness nor endorsement.",
      "conditions": [
        "Separate reconciliation from eligibility, payment, services and victim status."
      ],
      "option_ids": [
        "R8"
      ]
    },
    {
      "component_type": "amnesty",
      "status": "not_justified",
      "reason": "No packet evidence justifies amnesty. Financial transfers cannot purchase immunity under MC-05/MC-08.",
      "option_ids": []
    },
    {
      "component_type": "restriction",
      "status": "insufficient_evidence",
      "reason": "No person-specific danger evidence supports preventive restrictions. MC-05/MC-10 require individual justification, proportionality and review.",
      "option_ids": []
    },
    {
      "component_type": "rehabilitation",
      "status": "insufficient_evidence",
      "reason": "Perpetrator rehabilitation and safe reintegration require individual evidence absent here; rehabilitation advocate F6 supports neither automatic reintegration nor indefinite exclusion.",
      "conditions": [
        "Assess safety and rehabilitation individually alongside lawful accountability, without forced victim contact."
      ],
      "option_ids": []
    },
    {
      "component_type": "other",
      "status": "not_justified",